{
  "id": "222e1234-e29b-41d4-a716-446655440001",
  "name": "Spatial Effects Hub",
  "description": "Estacion de procesamiento integral que combina filtrado, dinamica y ecualizacion en baja latencia. Basado en el procesador CIM, este modulo expande sus capacidades para incluir compresion de precision y un ecualizador parametrico de alta fidelidad. Su mezclador interno permite la suma de fuentes con control granular sobre fase y amplitud, asegurando que la señal sea coherente y balanceada antes de ser enviada a la etapa de efectos espaciales o al bus de salida principal del sistema.",
  "ids_cim_reference": [
    "d4e5f6a7-b8c9-0d1e-2f3a-4b5c6d7e8f90"
  ],
  "nodes": [
    {
      "type": "reverb",
      "id": "222e1234-e29b-41d4-a716-446655440002",
      "name": "Cathedral Reverb Pro",
      "description": "Procesador de reverberacion algoritmica de alta densidad diseñado para crear espacios acusticos inmersivos y realistas. Utiliza una red de lineas de retardo realimentadas con filtros de dispersion para emular la absorcion natural de las superficies arquitectonicas. Su control de tamaño de sala permite transiciones fluidas desde pequeñas cabinas de grabacion hasta inmensas catedrales, proporcionando una cola de reverb rica y libre de resonancias metalicas indeseadas, ideal para añadir profundidad a fuentes sinteticas y vocales.",
      "ids_references": [],
      "others": [],
      "roomSize": {
        "id": "222e1234-e29b-41d4-a716-446655440003",
        "ids_references": [
          "992e8400-e29b-41d4-a716-446655440333"
        ],
        "initialValue": 0.8,
        "isModifiable": true,
        "description": ""
      },
      "damping": {
        "id": "222e1234-e29b-41d4-a716-446655440004",
        "ids_references": [
          "992e8400-e29b-41d4-a716-446655440333"
        ],
        "initialValue": 0.3,
        "isModifiable": true,
        "description": ""
      },
      "decayTime": {
        "id": "222e1234-e29b-41d4-a716-446655440005",
        "ids_references": [
          "992e8400-e29b-41d4-a716-446655440333"
        ],
        "initialValue": 2.5,
        "isModifiable": true,
        "description": ""
      },
      "dryWet": {
        "id": "222e1234-e29b-41d4-a716-446655440006",
        "ids_references": [
          "992e8400-e29b-41d4-a716-446655440333"
        ],
        "initialValue": 0.4,
        "isModifiable": true,
        "description": ""
      },
      "stereo": {
        "id": "222e1234-e29b-41d4-a716-446655440007",
        "ids_references": [
          "992e8400-e29b-41d4-a716-446655440333"
        ],
        "initialValue": true,
        "description": ""
      },
      "input_1": {
        "id": "222e1234-e29b-41d4-a716-446655440009",
        "ids_references": [],
        "isExternalInput": false,
        "description": ""
      },
      "input_2": {
        "id": "222e1234-e29b-41d4-a716-446655440010",
        "ids_references": [],
        "isExternalInput": false,
        "description": ""
      },
      "output_1": {
        "id": "222e1234-e29b-41d4-a716-446655440011",
        "ids_references": [],
        "isExternalOutput": false,
        "description": ""
      },
      "output_2": {
        "id": "222e1234-e29b-41d4-a716-446655440012",
        "ids_references": [],
        "isExternalOutput": false,
        "description": ""
      }
    },
    {
      "type": "delay",
      "id": "222e1234-e29b-41d4-a716-446655440013",
      "name": "Sync Delay Master ",
      "description": "Unidad de eco digital con sincronizacion de tempo y filtrado de realimentacion para texturas ritmicas complejas. Este bloque permite crear desde sutiles duplicaciones de señal hasta cascadas de eco infinitas gracias a su control de feedback compensado. La seccion de filtrado integrada (HPF/LPF) permite que las repeticiones se asienten perfectamente en la mezcla sin ensuciar las frecuencias bajas o competir con el brillo original de la fuente, siendo una pieza fundamental en el diseño de paisajes sonoros evolutivos.",
      "ids_references": [],
      "others": [],
      "delayTime": {
        "id": "222e1234-e29b-41d4-a716-446655440014",
        "ids_references": [
          "992e8400-e29b-41d4-a716-446655440333"
        ],
        "initialValue": 0.35,
        "isModifiable": true,
        "description": ""
      },
      "feedback": {
        "id": "222e1234-e29b-41d4-a716-446655440015",
        "ids_references": [
          "992e8400-e29b-41d4-a716-446655440333"
        ],
        "initialValue": 0.6,
        "isModifiable": true,
        "description": ""
      },
      "lowPassCutoff": {
        "id": "222e1234-e29b-41d4-a716-446655440016",
        "ids_references": [
          "992e8400-e29b-41d4-a716-446655440333"
        ],
        "initialValue": 5000,
        "isModifiable": true,
        "description": ""
      },
      "highPassCutoff": {
        "id": "222e1234-e29b-41d4-a716-446655440017",
        "ids_references": [
          "992e8400-e29b-41d4-a716-446655440333"
        ],
        "initialValue": 100,
        "isModifiable": true,
        "description": ""
      },
      "dryWet": {
        "id": "222e1234-e29b-41d4-a716-446655440018",
        "ids_references": [
          "992e8400-e29b-41d4-a716-446655440333"
        ],
        "initialValue": 0.3,
        "isModifiable": true,
        "description": ""
      },
      "stereo": {
        "id": "222e1234-e29b-41d4-a716-446655440019",
        "ids_references": [
          "992e8400-e29b-41d4-a716-446655440333"
        ],
        "initialValue": true,
        "description": ""
      },
      "input_1": {
        "id": "222e1234-e29b-41d4-a716-446655440021",
        "ids_references": [],
        "isExternalInput": false,
        "description": ""
      },
      "input_2": {
        "id": "222e1234-e29b-41d4-a716-446655440022",
        "ids_references": [],
        "isExternalInput": false,
        "description": ""
      },
      "output_1": {
        "id": "222e1234-e29b-41d4-a716-446655440023",
        "ids_references": [],
        "isExternalOutput": false,
        "description": ""
      },
      "output_2": {
        "id": "222e1234-e29b-41d4-a716-446655440024",
        "ids_references": [],
        "isExternalOutput": false,
        "description": ""
      }
    },
    {
      "type": "gain_pan",
      "id": "222e1234-e29b-41d4-a716-446655440025",
      "name": "Main Output Stage ",
      "description": "Etapa de salida y control final de la señal que gestiona la amplitud y el posicionamiento estereo antes del bus maestro. Proporciona un control de ganancia de alta fidelidad con curvas de respuesta logaritmicas para un ajuste de volumen musicalmente intuitivo. La seccion de paneo implementa una ley de potencia constante para asegurar que la percepcion de la sonoridad se mantenga estable independientemente de la posicion en el campo estereo, siendo el punto critico para el balance final de la produccion sonora.",
      "ids_references": [],
      "others": [],
      "gain": {
        "id": "222e1234-e29b-41d4-a716-446655440026",
        "ids_references": [
          "992e8400-e29b-41d4-a716-446655440333"
        ],
        "initialValue": 0.9,
        "isModifiable": true,
        "description": ""
      },
      "pan": {
        "id": "222e1234-e29b-41d4-a716-446655440027",
        "ids_references": [
          "992e8400-e29b-41d4-a716-446655440333"
        ],
        "initialValue": 0,
        "isModifiable": true,
        "description": ""
      },
      "stereo": {
        "id": "222e1234-e29b-41d4-a716-446655440028",
        "ids_references": [
          "992e8400-e29b-41d4-a716-446655440333"
        ],
        "initialValue": true,
        "description": ""
      },
      "input_1": {
        "id": "222e1234-e29b-41d4-a716-446655440030",
        "ids_references": [],
        "isExternalInput": false,
        "description": ""
      },
      "input_2": {
        "id": "02804ee0-7b17-4895-b013-df82bfb5fee5",
        "ids_references": [],
        "isExternalInput": false,
        "description": ""
      },
      "output_1": {
        "id": "222e1234-e29b-41d4-a716-446655440031",
        "ids_references": [],
        "isExternalOutput": true,
        "description": "Salida maestra izquierda del bus de efectos inmersivos."
      },
      "output_2": {
        "id": "222e1234-e29b-41d4-a716-446655440032",
        "ids_references": [],
        "isExternalOutput": true,
        "description": "Salida maestra derecha del bus de efectos inmersivos."
      }
    }
  ],
  "edges": []
}